{
    "$schema": "http://json-schema.org/draft-07/schema#",
    "title": "Skill Blueprint Schema",
    "description": "Antigravity Skill Factory - Blueprint definition schema. LLM must generate this FIRST before any file creation.",
    "type": "object",
    "required": [
        "skill_name",
        "entry_instruction",
        "guides"
    ],
    "properties": {
        "skill_name": {
            "type": "string",
            "description": "Unique identifier for the skill. Must not already exist in skill_registry.json.",
            "pattern": "^[a-z][a-z0-9_]*$"
        },
        "entry_instruction": {
            "type": "string",
            "description": "The primary instruction the skill executes first. Must exist in instruction_graph."
        },
        "instructions": {
            "type": "array",
            "items": {
                "type": "string"
            },
            "description": "All instruction nodes this skill uses."
        },
        "guides": {
            "type": "array",
            "items": {
                "type": "string"
            },
            "description": "Guide documents this skill references. Must exist in guide_graph.",
            "minItems": 1
        },
        "tools": {
            "type": "array",
            "items": {
                "type": "string"
            },
            "description": "External tools this skill depends on. Must exist in tool_registry."
        }
    },
    "additionalProperties": false
}