{
    "skill_name": "harness_orchestrator",
    "entry_instruction": "run_harness_orchestrator",
    "instructions": [
        "run_harness_orchestrator",
        "harness_preflight",
        "harness_complexity",
        "harness_analyze",
        "harness_forge",
        "harness_verify",
        "harness_exit"
    ],
    "guides": [
        "tot_guide",
        "skill_naming_guide",
        "blueprint_writing_guide"
    ],
    "tools": [
        "python_exec",
        "file_read",
        "file_write"
    ]
}