{
    "skill_name": "creation_phase1",
    "entry_instruction": "run_creation_phase1",
    "instructions": [
        "run_creation_phase1",
        "creation_world_builder",
        "creation_personality_designer"
    ],
    "guides": [
        "romance_guide",
        "typology_reference",
        "blueprint_writing_guide",
        "psy_love_theories",
        "psy_motivation_theories",
        "psy_trauma_defense",
        "psy_limerence",
        "psy_nonviolent_communication",
        "psy_love_and_jealousy",
        "psy_transactional_analysis",
        "psy_bl_romance_guide",
        "model_profiles"
    ],
    "tools": [
        "python_exec",
        "file_read",
        "file_write"
    ]
}